K2424	Transportation Terminal	Marina	N	N	Y	A place where privately owned, light-watercraft and/or houseboats are moored.
K2432	Transportation Terminal	Pier/Dock	N	Y	Y	A platform built out from the shore into the water and supported by piles. This platform may provide access to ships and boats, or it may be used for recreational purposes.
K2451	Transportation Terminal	Airport or Airfield	Y	Y	Y	A manmade facility maintained for the use of aircraft. [including airstrip, landing field, and landing strip]
K2452	Transportation Terminal	Train Station, Trolley or Mass Transit Rail Station	Y	N	Y	A place where travelers can board and exit rail transit lines, including associated ticketing, freight, and other commercial offices.
K2453	Transportation Terminal	Bus Terminal	Y	N	Y	A place where travelers can board and exit mass motor vehicle transit, including associated ticketing, freight, and other commercial offices.
K2454	Transportation Terminal	Marine Terminal	Y	N	Y	A place where travelers can board and exit water transit or where cargo is handled, including associated ticketing, freight, and other commercial offices.
K2455	Transportation Terminal	Seaplane Anchorage	Y	N	Y	A place where an airplane equipped with floats for landing on or taking off from a body of water can debark and load.
K2456	Transportation Terminal	Airport—Intermodal Transportation	Y	N	Y	A major air transportation facility where travelers can board and exit airplanes and connect with other (i.e. non-air) modes of transportation.
K2457	Transportation Terminal	Airport—Statistical Representation	N	N	Y	The area of an airport adjusted to include whole 2010 tabulation census blocks used for the delineation of urban areas.
K2458	Transportation Terminal	Park and Ride Facility /Parking Lot	Y	N	Y	A place where motorists can park their cars and transfer to other modes of transportation.
K2459	Transportation Terminal	Runway/Taxiway	Y	Y	Y	A fairly level and usually paved expanse used by airplanes for taking off and landing at an airport.
K2460	Transportation Terminal	Helicopter Landing Pad	Y	N	Y	A fairly level and usually paved expanse used by helicopters for taking off and landing.
K2540	Other Workplace	University or College	Y	N	Y	An institution for post-secondary study, teaching, and learning. [including seminary]
K2543	Other Workplace	School or Academy	Y	N	Y	An institution for preschool, elementary or secondary study, teaching, and learning.
K2545	Other Workplace	Museum, Visitor Center, Cultural Center, or Tourist Attraction	Y	N	Y	An attraction of historical, cultural, educational or other interest that provides information or displays artifacts.
K2561	Other Workplace	Golf Course	Y	N	Y	A public or private facility designed for playing golf.
K2564	Other Workplace	Amusement Center	N	N	Y	A facility that offers entertainment, performances or sporting events. Examples include arena, auditorium, theater, stadium, coliseum, race course, theme park, fairgrounds and shooting range.
K2582	Other Workplace	Cemetery	Y	N	Y	A place or area for burying the dead. [including burying ground and memorial garden]
K2586	Other Workplace	Zoo	Y	N	Y	A facility in which terrestrial and/or marine animals are confined within enclosures and displayed to the public for educational, preservation, and research purposes.
K3544	Other Workplace	Place of Worship	Y	N	Y	A sanctified place or structure where people gather for religious worship; examples include church, synagogue, temple, and mosque.
L4010	Miscellaneous Linear Features	Pipeline	N	Y	N	A long tubular conduit or series of pipes, often underground, with pumps and valves for flow control, used to transport fluid (e.g., crude oil, natural gas), especially over great distances.
L4020	Miscellaneous Linear Features	Powerline	N	Y	N	One or more wires, often on elevated towers, used for conducting high- voltage electric power.
L4031	Miscellaneous Linear Features	Aerial Tramway/Ski Lift	N	Y	N	A conveyance that transports passengers or freight in carriers suspended from cables and supported by a series of towers.
L4110	Miscellaneous Linear Features	Fence Line	N	Y	N	A man-made barrier enclosing or bordering a field, yard, etc., usually made of posts and wire or wood, used to prevent entrance, to confine, or to mark a boundary.
L4121	Miscellaneous Linear Features	Ridge Line	N	Y	N	The line of highest elevation along a ridge.
L4125	Miscellaneous Linear Features	Cliff/Escarpment	N	Y	N	A very steep or vertical slope. [including bluff, crag, head, headland, nose, palisades, precipice, promontory, rim, and rimrock]
L4130	Miscellaneous Linear Features	Point-to-Point Line	N	Y	N	A line defined as beginning at one location point and ending at another, where each of these points is usually in sight of the other and no structures are in proximity to the line. This includes straight-line, nonvisible, 180-degree extensions off the ends of a terminating linear feature.
L4140	Miscellaneous Linear Features	Property/Parcel Line (Including PLSS)	N	Y	N	A cadastal boundary line separating two distinct real property parcels or a Public Land Survey System or equivalent survey line.
L4150	Miscellaneous Linear Features	Coastline	N	Y	N	The line that separates either land or Inland water from Coastal, Territorial or Great Lakes water. Where land directly borders Coastal, Territorial or Great Lakes water, the shoreline represents the Coastline. Where Inland water (such as a river) flows into Coastal, Territorial or Great Lakes water, the closure line separating the Inland water from the other class of water represents the Coastline.
L4165	Miscellaneous Linear Features	Ferry Crossing	N	Y	N	A nonvisible feature defining the route used to carry or convey people or cargo back and forth over a waterbody in a boat.
P0001	Bounding Edges and Non-Feature Edges	Nonvisible Linear Legal/Statistical Boundary	N	Y	N	A legal/statistical boundary line that does not correspond to a shoreline or other visible feature on the ground.
P0002	Bounding Edges and Non-Feature Edges	Perennial Shoreline	N	Y	N	The more-or-less permanent boundary between land and water for a water feature that exists year-round.
P0003	Bounding Edges and Non-Feature Edges	Intermittent Shoreline	N	Y	N	The boundary between land and water (when water is present) for a water feature that does not exist year-round.
P0004	Bounding Edges and Non-Feature Edges	Other Non-Visible Edge	N	Y	N	An edge that does not represent a legal/statistical boundary, and does not correspond to a shoreline or other visible feature on the ground. Many such edges bound area landmarks, while many others separate water features from each other (e.g., where a bay meets the ocean).
R1011	Rail Features	Rail Feature	N	Y	N	A fixed rail line, generally visible from the surface, which carries any type of rail vehicle including railroad, off-street transit and mountain rail systems.
S1100	Road/Path Features	Primary Road	N	Y	N	Primary roads are limited-access highways that connect to other roads only at interchanges and not at at-grade intersections. This category includes Interstate highways, as well as all other highways with limited access (some of which are toll roads). Limited-access highways with only one lane in each direction, as well as those that are undivided, are also included under S1100.
S1200	Road/Path Features	Secondary Road	N	Y	N	Secondary roads are main arteries that are not limited access, usually in the U.S. highway, state highway, or county highway systems. These roads have one or more lanes of traffic in each direction, may or may not be divided, and usually have at-grade intersections with many other roads and driveways. They often have both a local name and a route number.
S1400	Road/Path Features	Local Neighborhood Road, Rural Road, City Street	N	Y	N	Generally a paved non-arterial street, road, or byway that usually has a single lane of traffic in each direction. Roads in this feature class may be privately or publicly maintained. Scenic park roads would be included in this feature class, as would (depending on the region of the country) some unpaved roads.
S1500	Road/Path Features	Vehicular Trail (4WD)	N	Y	N	An unpaved dirt trail where a four-wheel drive vehicle is required. These vehicular trails are found almost exclusively in very rural areas. Minor, unpaved roads usable by ordinary cars and trucks belong in the S1400 category.
S1630	Road/Path Features	Ramp	N	Y	N	A road that allows controlled access from adjacent roads onto a limited access highway, often in the form of a cloverleaf interchange.
S1640	Road/Path Features	Service Drive usually along a limited access highway	N	Y	N	A road, usually paralleling a limited access highway, that provides access to structures and/or service facilities along the highway. These roads can be named and may intersect with other roads.
S1710	Road/Path Features	Walkway/Pedestrian Trail	N	Y	N	A path that is used for walking, being either too narrow for or legally restricted from vehicular traffic.
S1720	Road/Path	Stairway	N	Y	N	A pedestrian passageway from one level to another by a series of steps.
S1730	Road/Path Features	Alley	N	Y	N	A service road that does not generally have associated addressed structures and is usually unnamed. It is located at the rear of buildings and properties and is used for deliveries.
S1740	Road/Path Features	Private Road for service vehicles (logging, oil fields, ranches, etc.)	N	Y	N	A road within private property that is privately maintained for service, extractive, or other purposes. These roads are often unnamed.
S1750	Road/Path Features	Internal U.S. Census Bureau use	N	Y	N	Internal U.S. Census Bureau use.
S1780	Road/Path Features	Parking Lot Road	N	Y	N	The main travel route for vehicles through a paved parking area. This may include unnamed roads through apartment/condominium/office complexes where pull-in parking spaces line the road.
S1820	Road/Path Features	Bike Path or Trail	N	Y	N	A path that is used for manual or small, motorized bicycles, being either too narrow for or legally restricted from vehicular traffic.
